answer,theme
расторгнуть кредитной,Кредит
на экране что,Адреса офисов и банкоматов
поговорить мне нужно срочно долга то в на,Задолженность
мне здравствуйте,Приветствие
я по платежу,Обслуживание карт
что за ипотечное пожалуйста я вот оформила вас кредит,Получения кредита
меня интересует где находятся где находятся ваши отделения банка,Адреса офисов и банкоматов
меня интересует вот не отправили код я не должен не лица в в отделении банка чтобы под рукой то я могу сейчас то вам сразу по просто был от решении,Адреса офисов и банкоматов
работа с платежами,Обслуживание карт
я хотела бы сделать заявку на кредит,Получения кредита
мне пришло письмо по справки доходы физических лиц мне надо узнать вот стоит,Физические лица
меня интересует то что деньги банкомат положила мне надо положить снять обратно и по там положить мне вот банком а деньги не выдает что отдела,Адреса офисов и банкоматов
алло я,Кредит
мне мне поступать звонке от вашего банка не знаю по какой причине алло,Вам звонили
меня интересует смс с у вас уже погашение кредита,Действующий кредит
ничего не интересует во сюда звонили,Вам звонили
кредит открыт ли,Получения кредита
я пришел код,Обслуживание карт
установить эквайринг,Эквайринг
да по задолженности по кредиту,Задолженность
свяжите с консультантом у кредит,Перевод на оператора
уточнить адрес,Адреса офисов и банкоматов
мне пришла смска что мне одобрили кредит я хотела бы узнать подробности,Получения кредита
условия по оформленному кредиту,Получения кредита
меня интересует кредит кредитная карточка,Обслуживание кредитных карт
меня интересует не пришел код с вашего банка,Обслуживание карт
номер телефона филиала в кирове на воровского двадцать один,Адреса офисов и банкоматов
где можно снять деньги ну что,Адреса офисов и банкоматов
алло вы мне звонили сегодня по какому вопрос а можно узнать,Вам звонили
как работает ваш офис в городе воронеже завтра,Адреса офисов и банкоматов
действующей кредит,Действующий кредит
скажите пожалуйста сегодня сегодня у меня заканчивается срок вклада,Задолженность
карточка зарплатная,Карты
вопрос по комиссии за или расчета внести на две сим клиентам денег от при,Обслуживание карт
мы не знаю вы мне звонили это будет телефон,Вам звонили
вам отправить письмо с просьбой о кредитных к ним шестьдесят дней,Кредит
именно,Карты
курс,Курсы валют
еще раз добрый день,Приветствие
здравствуйте я получу карта прошлом году я и,Обслуживание карт
как в погашение кредита,Действующий кредит
отделение в городе салават телефон,Адреса офисов и банкоматов
ой вы знаете у нас ждите от кто то должен у него долго анкета заявление что то двести двадцать четыре пятьсот девяносто восемь,Карты
поговорить с оператором идет к,Перевод на оператора
мне получение кредита,Получения кредита
почему у меня карта нет,Карты
какой комплект документов я должна предоставить в банк для открытия расчетного счета юридического лица,Расчетный счет
в москве ближайший адреса,Адреса офисов и банкоматов
забыла пароль,Интернет банк
закрыть счет,Расчетный счет
как получить кредит,Получения кредита
задолженность задолженность на интересует,Задолженность
алло мы хотели бы взять кредит как нам забрать,Получения кредита
меня интересует минимальный платеж по кредиту,Действующий кредит
оформить карту,Получение карты
кредит то в омске здесь,Кредит
задолженность по кредитной карты,Задолженность
нет по денежным кредиту кредит наличными,Получения кредита
у меня вот интересует код три дэ секьюри для действующей карте,Обслуживание карт
был просрочен про платеж узнать,Задолженность
как переоформить кредит,Кредит
обслуживание банкоматов тарифы,Адреса офисов и банкоматов
потребительское нас,Карты
кредит наличными хотел бы,Получения кредита
не не не с оператором,Перевод на оператора
меня интересует приобрести доллары,Курс доллара
да ставка на карту,Карты
узнать по кредитной карте и задолжность или нет,Обслуживание кредитных карт
а меня интересует платеж по кредиту,Действующий кредит
хотела узнать результат по заявке по кредиту,Получения кредита
ушли,Кредит
интернет и кредит,Кредит
какие взять кредит,Получения кредита
отделение на локальном магистраль город новосибирск,Адреса офисов и банкоматов
номер телефона своего операционист,Перевод на оператора
меня интересуют часы работы офиса на бы да пеший улица сорок шесть получение кредита,Адреса офисов и банкоматов
я пришел,Кредит
перевести платеж,Действующий кредит
остаток задолженности по задолженности по действующим кредиту,Действующий кредит
меня интересует вопрос по карте,Карты
пришла смс от вашего банка что в для получения кредита мне нужно,Получения кредита
мне нужно узнать вот на заплатили двадцать четыре пятьсот,Обслуживание карт
узнать одобрен ли кредит,Получения кредита
блокирование карты,Блокировка карты
долг по кредиту,Задолженность
мира,Карты
от действующей карте,Обслуживание карт
мне надо почему у меня на у меня заблокирована карта из,Обслуживание карт
алло предложение по кредиту,Кредит
меня пожалуйста оператор,Перевод на оператора
там ну с она какие расчетного счета,Расчетный счет
мне пришел код,Обслуживание карт
кб мой мне нужен оператор живем сколько можно,Перевод на оператора
по дала заявку на кредит,Получения кредита
меня интересует почему я не могу с банкомата а деньги снять,Не работает банкомат
пароль на,Интернет банк
чтоб мне звонили не беспокою или,Вам звонили
нужен специалист,Перевод на оператора
хотел бы у вас уточнить где находится с вашим,Адреса офисов и банкоматов
какая сейчас так по рефинансированию банка,Получения кредита
да да второй,Кредит
банкомат то зажевал карту,Не работает банкомат
а да переводу золотая корона есть,Денежные переводы
я хочу оператора,Перевод на оператора
сообщений интересует обновление ваши программы причем день банкомат,Адреса офисов и банкоматов
по карточке,Обслуживание карт
режим работы офиса,Адреса офисов и банкоматов
мне нужен человек,Перевод на оператора
пароль от интернет банка юридические лица,Интернет банк
в ленте банке у меня написано систем ошибка обратить служба технической поддержки,Интернет банк
хотел бы связаться с вашим оператором,Перевод на оператора
лимита кредит лимит,Обслуживание кредитных карт
лимит по получить не снятие наличных,Обслуживание карт
на какой стадии находится рассмотрения заявки,Адреса офисов и банкоматов
вернуть карту,Карты
у меня пропущенный звонок с вашего номер,Вам звонили
сколько стоят акции,Акции
да по здесь,Кредит
год нет пал получить кредит хочу,Получения кредита
купить евро меня интересует,Курс евро
сами звонили,Вам звонили
по день по действующей карте,Обслуживание карт
я хотела бы мне сегодня звонили предложения две карты так как у меня карта по заработной оплате заканчивается положили две карты,Обслуживание карт
мне как получить деньги мне выслали пароли сказали что я могу прийти получить заказать свой пароль,Обслуживание вкладов
белгородская валюта,Курсы валют
меня интересует то что вот я сейчас мне предложение кредит взять и сейчас пришла брать кредит мне сказали,Получения кредита
операции номер телефона операциониста по юридическим лицам,Юридические лица
чтобы получить кредит дом заберите дон,Получения кредита
ну у меня карточка не проходит,Карты
извините я готов говорить с автоматом о живым человеком что то про,Перевод на оператора
после регистрации в отделение,Адреса офисов и банкоматов
курс доллара курс покупки доллара,Курс доллара
заказать деньги,Обслуживание вкладов
а мне вот смска пришла на телефон с кодом можно пришел информацию что такое,Обслуживание карт
я хочу узнать можем такая быть пишет я положила команд на это из автомата десять тысячи мне выходит чек на восемь тысяч вот ошибка,Обслуживание карт
хотели получить кредит,Получения кредита
здравствуйте мне пришла смс кодом,Обслуживание карт
для получения кредита я как прийти в банке предоставить код,Получения кредита
перевод денег не дошел да адреса то,Обслуживание карт
постоянному звонки по этому телефону,Вам звонили
я хочу открыть вклад меня интересует процент по вкладам,Открыте вклада
помощь по интернет банку,Интернет банк
на терминал не работает,Пос терминал
я хочу заплатить,Обслуживание карт
свяжите с оператором елки палки,Перевод на оператора
мне был сделан звонок на сотовый телефон,Вам звонили
здравствуйте меня интересует платеж с физ лица,Обслуживание карт
карта это кредит,Обслуживание кредитных карт
какой самые высокий процент по вкладам,Открыте вклада
сколько курс,Курсы валют
новый в офис на это пишет сорок шесть деньги а где расположены ближайшее метро,Адреса офисов и банкоматов
действующие карточка почему иметь,Обслуживание карт
кредитной истории,Кредит
карточку нашел говорю свою,Обслуживание карт
да золотая золотая корона перевод,Денежные переводы
я не знаю нет мне звонили два раза я хотела бы узнать по какому поводу,Вам звонили
меня интересует вот просрочен просроченный какая задолженности у меня по карте,Задолженность
мне задолжность моя интересует почему то я уже давно ее выплатила,Задолженность
рефинансирование,Получения кредита
интернет банк в а это,Интернет банк
здравствуйте я звоню по поводу кредита мне пришло смс хотел бы узнать,Получения кредита
алло кредитная карта да у него от номер сейчас скажу какой,Кредитные карты
а и не может быть и системы интернет банк про,Интернет банк
потому что кто то с вас звонил все да ко мне домой не погасил что бы я оформила кредит не зачем вас кредит нужен,Вам звонили
в тройке,Кредит
ваш клиент,Кредит
обмен евро,Курс евро
можно ли снять деньги через кассу банке,Интернет банк
нет то где то без еще кредита просто мне выяснить остаток и может за,Действующий кредит
меня интересует алло что как и моя всеми и офисов,Адреса офисов и банкоматов
специалист мне интересе,Перевод на оператора
насчет кредита хотел узнать,Получения кредита
где то что карта,Карты
по кредитам вопрос,Действующий кредит
меня интересует покупка евро,Курс евро
если на какой то долг в какой то до по по этой по кредиту,Задолженность
оплата по кредиту карта заложенность по кредитной карте,Обслуживание кредитных карт
меня интересует узнать по поводу карты,Карты
оплата счетов,Обслуживание карт
проценты по вкладу,Открыте вклада
мне прислали заказ на письмо в что справочка доходах физического лица я хотел бы узнать что это такое,Физические лица
как как оформить кредит,Получения кредита
какая то задолженность у меня вдруг,Задолженность
оператор меня интересует,Перевод на оператора
никто не кредит,Обслуживание кредитных карт
пришел код что с ней делать,Обслуживание карт
с кем мне переговорить по по чипу дальше чего отделение вашего банка,Адреса офисов и банкоматов
я бы хотела адрес узнать,Адреса офисов и банкоматов
меня интересует и кредит для ип,Кредит
в течение,Кредит
оплата договора кредита,Действующий кредит
нужно ответа оператора,Перевод на оператора
меня интересует кредит алло часа,Кредит
кредит на счету потребительском кредите,Кредит
меня интересует почему у меня карта не привязанная петро,Карты
банк ваш юге находится вообще есть филиал банка ваша или нет,Адреса офисов и банкоматов
получить помощь,Получения кредита
привести к оператору,Перевод на оператора
разблокировка счета,Обслуживание карт
продление кредитной карты,Обслуживание кредитных карт
телефон офиса на и пина,Адреса офисов и банкоматов
а проблема с картой,Карты
платежно платежное поручение,Платежное поручение
соединиться мне на кредитов валютном контроле передать в,Курсы валют
мне сейчас что бы вы звонили из то интересует не знаю,Вам звонили
выписка выписка по вкладам,Вклад
служба безопасности московском филиала,Адреса офисов и банкоматов
здравствуйте меня интересует вот мне сказали в банк пришли,Приветствие
нет а работа с юридическими лицами,Интернет банк
как не,Карты
задолженность по кредиту задолжность по кредитам,Задолженность
когда мне оператора пожалуйста,Перевод на оператора
долг,Задолженность
меня интересует офис где можно получить кредит в краснодаре,Адреса офисов и банкоматов
зенит,Карты
данный момент будет кредит,Кредит
терминал не один,Пос терминал
сумму сто пароль и сказали,Интернет банк
алло мне звонили на счет,Вам звонили
и,Кредит
интернет банк лайне,Интернет банк
справочная служба,Интернет банк
интересует когда закончится мой,Задолженность
банкомат в городе по ли в каком,Адреса офисов и банкоматов
действующих кредит платеж по кредиту,Действующий кредит
алло интересует потребительский кредит,Кредит
по работе с юрлицами,Юридические лица
юридические все движения по счета юридического лица,Юридические лица
баланс на счете,Обслуживание карт
доллар в красноярске,Курс доллара
какой у меня остаток по кредиту остался,Действующий кредит
есть еще карта,Карты
карт,Карты
да да верно,Адреса офисов и банкоматов
отказаться отказаться от карта,Карты
меня интересует кредит наличными в городе воронеже где можно взять не дошли алло,Получения кредита
соедините меня пожалуйста оператора,Перевод на оператора
ваш разговор будет продолжен пожалуйста оставайтесь на линии якобы с деньги в кассе нет при алло алло давай,Действующий кредит
м на открытие счета юридическим лицам,Расчетный счет
зенит со специалистом,Перевод на оператора
а я хотел бы узнать по поводу карточки перечислении,Обслуживание карт
информация по интернет банку,Интернет банк
как положить на баланс карты,Обслуживание карт
звоню чтобы от рефинансирование,Получения кредита
меня интересует можно с натальей переговорить мне наталья звонил,Вам звонили
или,Кредит
перевыпуск карты зарплатной,Получение карты
вопросик по кредиту,Кредит
обмен курс валют,Курсы валют
пунктов по кредитной карте,Кредитные карты
оператора надо со счета,Перевод на оператора
текущие карты,Обслуживание карт
сейчас по кредит,Кредит
о зачислении на карту,Обслуживание карт
оплата через интернет,Обслуживание карт
с,Карты
скажите пожалуйста с оператором,Перевод на оператора
алло банкомат банк банкомат не выдал денег,Адреса офисов и банкоматов
узнать узнать курс доллара дома девятнадцатого января,Курс доллара
здравствуйте мне звонили по поводу кредита буквально около часа назад хотелось бы переговорить еще раз ну там по до вопрос,Вам звонили
плате получение кредита,Получения кредита
алло до говорю,Карты
ответа связаться с сотрудником банка,Перевод на оператора
меня интересует аппарат по,Адреса офисов и банкоматов
