answer,theme
алло алло доллара поменять,Курс доллара
кредит для пенсионеров,Кредит
интересует проблема с банкоматом,Не работает банкомат
алло девушка алло вот на кредит,Кредит
из,Карты
почему бы мне был звонок я не успел с,Вам звонили
по поводу кредита выяснить,Кредит
мне нужно поговорить по поводу просроченного платежа,Задолженность
ну что деньги через терминал магазин,Пос терминал
снятие денежных средств со расчетного счета,Расчетный счет
новый с какой баланс узнать об этом адресу банк,Обслуживание карт
онлайн поддержка банк клиент,Интернет банк
я хочу я по интернету а пор на заявка на кредит,Получения кредита
мне пришло индивидуально код на получение кредита,Получения кредита
утеряна платеж,Обслуживание карт
заявка банк на кредит,Получения кредита
блин,Карты
выписка по кредитной карте,Кредитные карты
а где находится банк в городе бийске если на линии,Адреса офисов и банкоматов
что за бред ну,Кредит
ну соедините меня с оператором с кем от не пришла пошел банка для оформления кредита,Перевод на оператора
как изменить номер телефона привязана карта,Получение карты
интересуют вклады,Вклад
информация по кредиту банкомат,Получения кредита
меня интересует почему не прошел платеж по карте,Обслуживание карт
замена карточки,Получение карты
ага получение кредита,Получения кредита
вклады вклады перевести,Вклад
я уже поменял оформить кредит не пришло подтверждение,Получения кредита
меня интересует кредит моего уже,Кредит
не ответил пин код,Обслуживание карт
я хотела бы с карточки снять наличку заказать деньги,Обслуживание вкладов
взять кредит и на мой номер пришел какой то номер,Обслуживание карт
оставляла заявку на кредит звоню,Получения кредита
у меня закрыт доступ к интернет,Интернет банк
оформить кредит,Получения кредита
меня интересует карта открыта и под какие проценты на выдается,Получение карты
зайти в личный кабинет,Интернет банк
меня интересует оператор банка,Перевод на оператора
мне ее надо сдавать или не надо просто кончается и все и,Задолженность
подтвердить платежку,Обслуживание карт
меня интересует моя фамилия томске не почему не шестого числа до сих пор не снят ареста,Адреса офисов и банкоматов
техподдержка интересует,Интернет банк
расскажите пожалуйста об про вклады,Вклад
я внесла денежные средства на банкомат альфабанка и или про и не произошло никакой операций,Адреса офисов и банкоматов
кредит оформление,Получения кредита
мне не специалистом банка,Перевод на оператора
здравствуйте я хотела бы узнать ваши под на с на,Приветствие
вчера ку ку один на покупку и терминал по,Пос терминал
об уже текущего вклада,Обслуживание вкладов
ареста карты,Карты
мне пришло сообщение по поводу оформить кредит,Получения кредита
настройка интернет банка,Интернет банк
там по вкладам,Вклад
мы брали закрыть ну я сегодня поехать оплатила это сорок две с половиной тысяч и смска пришла что две тысячи четыреста остаток какой то не опять,Обслуживание карт
через банкомат,Адреса офисов и банкоматов
здравствуйте у меня ничего не интересует я просто видимо ваш номер не знаю что то реконструкции и развития,Приветствие
и не кредит,Кредит
интернет банк интересуют,Интернет банк
здравствуйте мне бы узнать насчет процентные ставки можно у вас,Процентные ставки
усилия позвонить по уточнение окна кредита,Получения кредита
а действующему кредиту вопрос,Действующий кредит
утро у нас пароль,Интернет банк
не дозвониться не с на,Карты
не нет не получить,Обслуживание карт
а взять кредит в вашем банке,Получения кредита
что то перестал работать терминал,Пос терминал
как билет кредит,Кредит
здравствуйте,Кредит
было ли зачисление на карту,Получение карты
у меня вопрос по кредиту я хотел бы узнать действительна или мне его одобрили и мне бы свои код по смс,Получения кредита
ейск она не нашла,Кредит
гос по,Кредит
отель,Карты
найти на сайте,Адреса офисов и банкоматов
вы звонили по этому телефону,Вам звонили
можно подойти,Кредит
какая берется комиссия за перевод денежных средств,Денежные переводы
платежная карта,Карты
нет у меня на хом мне просто узнать пол года прошло мне должны были с ним процент,Процентные ставки
интернет банк где юридических лиц,Интернет банк
меня интересует цифрового работа с оператором,Перевод на оператора
пакет документов для оформления кредита,Получения кредита
меры,Кредит
кредит оператор,Перевод на оператора
мне звонили,Вам звонили
инфа заводе,Кредит
так у меня условия договора по кредиту потребительского кредита,Получения кредита
без карта,Карты
жалоба,Претензии
алло здравствуйте мне пришло смс кода,Приветствие
свяжите меня с диспетчером,Перевод на оператора
получатель алло здравствуйте вот рынок,Приветствие
по заявке на кредит,Получения кредита
нет интернет банк,Интернет банк
поговорить с оператором мне интересно,Перевод на оператора
не могу оплатить по карте оплата на продукцию о в интернет магазине,Обслуживание карт
я хотела бы узнать про кредит,Получения кредита
терминал заблокировал мою карту,Блокировка карты
ничего не кредита,Кредит
пришло сообщение что какой какой то кредита банке,Кредит
поступления средств на карту,Обслуживание карт
я вот пришло смс пришла,Обслуживание карт
о том то что я могу,Карты
адрес ваш города самары,Адреса офисов и банкоматов
ну похоже что так если вы так вопрос совете,Карты
хочу узнать адрес,Адреса офисов и банкоматов
где то,Кредит
добрый день мне нужно узнать каким образом провести операции по смене пароля ключа и э вакансии,Интернет банк
вклад в удобном плюс,Вклад
алло с оператором можно соединить,Перевод на оператора
нет алло чип кредит у меня у меня ну там не поступила смс сообщения,Кредит
как сказать алло интересует задолженность моей дочери,Задолженность
интернет банк лизинг,Интернет банк
кредит и,Кредит
меня интересуют платежи по карте,Обслуживание карт
не карту в лайн банк,Карты
течение кредит,Кредит
здравствуйте меня интересует погашения долга досрочное,Действующий кредит
пластиковые карты,Карты
зенита,Кредит
уже по кредиту,Кредит
по ну пожалуйста не кредита какой сумму надо внести,Кредит
покупка долларов на менделеева сто тридцать семь бы,Курс доллара
адрес банка город астрахань,Адреса офисов и банкоматов
у меня банкомат зажевал карточку не отдает,Не работает банкомат
график платежей не за кредит,Действующий кредит
перенести платеж по кредиту,Действующий кредит
можно мне узнать баланс,Обслуживание карт
мы бы хотели оставить заявку на получение кредита,Получения кредита
оформить кредитную карту оформить,Продажа кредитных карт
здравствуйте просьба выслать а интернет ой по сбыту и пароль для входа в интернет банк,Интернет банк
при кредит оформлять,Получения кредита
не взять кредит на карту как,Обслуживание кредитных карт
вклад вклад оплатить оплатить не по действующим кредиту оплатить,Действующий кредит
выписка из кредитной истории,Кредит
у меня понимаю деле оно перевели зарплату и как бы деньги не пришли на карточку,Обслуживание карт
информация по мобильному банку,Мобильный банк
мне по по оплате,Обслуживание карт
мне нужно узнать почему то ли сто она карта сбер в алло вашего банка,Карты
не не кредит,Кредит
году,Вклад
зарплату банковских карт,Карты
меня интересует процент я хочу открыть вклад в вашем банке,Открыте вклада
я хотела бы узнать просроченной задолженности,Задолженность
нет по расчетного счета,Расчетный счет
да по поводу действующим кредиту,Действующий кредит
филиал город пермь,Адреса офисов и банкоматов
алло мне вот пришел значит кредита,Кредит
по банку у меня,Карты
ошибка банка работы бы ошибка работа банкомата,Адреса офисов и банкоматов
да за уже ипотеке,Кредит
поступления на карту пенсии,Обслуживание карт
узнать счет карты,Реквизиты банка
адрес банкомата,Адреса офисов и банкоматов
меня интересует я оставила заявка на что кредита хотел узнать там меня одобрили кредит или отказаться отдел,Получения кредита
да бы вы мне звонили,Вам звонили
карта карта карта,Карты
забыла пин код от карты,Обслуживание карт
что понимается с оператором с оператором соедините с,Перевод на оператора
как а если переложить денежные сызрани и снимая денежные средства с банкомата другого банка какая комиссия,Адреса офисов и банкоматов
одноразовый пароль меня войти банка,Интернет банк
звонок бы у меня четырнадцатого пропущенный я не видел а сейчас сегодня только видел а вы что случилось,Вам звонили
алло ну вы что с прислали там по пути на акции,Акции
мне нужен специалист банка,Перевод на оператора
мне сегодня пришла смска по поводу переведены не денег на карту,Обслуживание карт
интересует просто купить доллар область,Курс доллара
проблема с картой,Карты
вопрос по мобильному приложению банка,Мобильный банк
да вы мне звонили я поэтому звоню вам что мы хотели,Вам звонили
поиск часть кредит,Адреса офисов и банкоматов
мне нужен специалист,Обслуживание кредитных карт
нет не мобильный интернет банк не работает,Интернет банк
по карте заблокировать,Блокировка карты
не работает банкомат,Не работает банкомат
алло мне пришел пин код,Обслуживание карт
я хотел я я хочу проконсультироваться с менеджером,Получения кредита
кредиты к по телевидения что выдача такого у меня был когда то заплатить кредит вот нет вот утеряна меня меня интересует что тут но это рекламы какая,Действующий кредит
не поняла вот,Карты
не поступили деньги на карточку через терминал,Обслуживание карт
меня интересует сообщения которые получил с кодом для получения кредита,Получения кредита
карта и развития,Карты
возврат платежа,Обслуживание карт
отдел по работе с кредит алле меня интересует с действующими просрочена мили дочь,Задолженность
время работы филиала по грушки какой пятьдесят шесть,Адреса офисов и банкоматов
каковы ставки по депозитам на сегодняшний день,Вклад
есть ли задолженность по кредиту,Задолженность
из это самое,Карты
общие кредит,Кредит
что слушаете мне нужно взять кредит я оформляла,Получения кредита
заявку на кредит хочу сделать пришла от вашего банка смска,Получения кредита
меня интересует насчет это платежа,Обслуживание карт
алло у меня вопрос по интернет банку как,Интернет банк
телефон филиал в городе уфе по адресу менделеева сто тридцать семь,Адреса офисов и банкоматов
по поводу кредитные кредит,Кредит
физические лица,Физические лица
тринадцатого декабря с на ту года я взяла у вас кредит,Получения кредита
открытие счета юридического лица,Расчетный счет
расчетный счет юридического лица,Расчетный счет
заблокируйте карту,Блокировка карты
адрес отделения банка город казань,Адреса офисов и банкоматов
банковская гарантия при заключении договора,Интернет банк
вот такой я не знаю,Адреса офисов и банкоматов
надо кредита миллионов рублей дали заявку,Получения кредита
с оператором свяжите меня пожалуйста,Перевод на оператора
меня информации интересует разблокировки карточки,Обслуживание карт
банкомат банкомат,Адреса офисов и банкоматов
зайти вам логин и пароль к онлайн банк,Интернет банк
открыл новую карточку и нет оповещения о,Получение карты
а карточка мы закрыли,Обслуживание карт
открыть расчетный счет,Расчетный счет
соединить с сотрудниками,Перевод на оператора
операции клиент банк,Интернет банк
оплата кредита,Обслуживание карт
обслуживание кредитной карты,Кредитные карты
получение кредитной карты,Продажа кредитных карт
нет у меня кредит я хочу узнать,Получения кредита
закрылся ли кредит у меня,Действующий кредит
оценка вклада,Вклад
нет делала заявку на кредит пришло пришло смс услуг с кодом что это значит,Получения кредита
зайти в банкомат вот что у нас интересует сколько вам еще раз сказать,Адреса офисов и банкоматов
ты,Карты
мне нужен телефон операционного офиса ульяновский филиал пермский,Адреса офисов и банкоматов
узнать при строение карточного счета,Реквизиты банка
меня интересует я могу заплатить в аижк в районе я в казани брала кредита в аижк районе можно спросить,Действующий кредит
по поводу кредита можно узнать,Получения кредита
об оплате кредита,Действующий кредит
у меня одобрения по кредиту хотел бы узнать,Получения кредита
а лимит так и по кредитной карте,Обслуживание кредитных карт
в евро,Курс евро
пропущенный звонок,Вам звонили
алло что интересует вот я был сбой банкомата что такое нужно поговорить с вашим банком алло я хотел деньги получить номер пять тысяч не выдал а с его,Не работает банкомат
надо снять деньги закончится вклад по счету,Задолженность
нужно кредитной карты,Кредитные карты
одобрен ли кредит,Кредит
мне карточка,Карты
онлайн платежей,Интернет банк
был пропущенный вызов,Вам звонили
хочу связаться с менеджером городе барнаул,Перевод на оператора
действующую карта,Обслуживание карт
заказать деньги в кассе,Обслуживание вкладов
могу я открыть вашем банке брокерский счет торговли,Расчетный счет
алло извините мне нужно отсылать вас расчетный счет,Расчетный счет
вопрос по оператору,Перевод на оператора
купить доллары до какого времени,Курс доллара
девушка здравствуйте,Приветствие
я куда какой лимит какая то не лимит,Обслуживание карт
меня интересует телефон на мало со восемьдесят четыре отделение,Адреса офисов и банкоматов
валюта курс доллара,Курс доллара
тарифы по расчетного счета,Расчетный счет
не нет офисы обслуживания,Адреса офисов и банкоматов
назаров да,Карты
меня интересует работает ли филиала отделения банка в городе каспийске воскресенье,Адреса офисов и банкоматов
взять,Получения кредита
нет денег на счету сети оператор,Перевод на оператора
подать заявку на кредит,Получения кредита
как положить на баланс деньги с карты,Обслуживание карт
вопрос по ипотечному кредиту,Действующий кредит
мне надо пообщаться с оператором по поводу текущий кредит,Перевод на оператора
по поводу карты,Обслуживание карт
а кредитная карта,Кредитные карты
нам надо ввести код чтобы зайти в банк,Обслуживание карт
меня интересует вклад на чтобы его продлить,Вклад
получение кредита хочу взять,Получения кредита
при действует ли вклад,Обслуживание вкладов
звонили и пригласительного,Вам звонили
это чип это верно,Карты
какой сейчас какая процентная ставка по вкладу,Открыте вклада
я девушка выбрать по мне позвонили что предварительно можно мне взять кредит,Вам звонили
звоню вклада,Вклад
отделение банка работает,Адреса офисов и банкоматов
не пришел пароль это интернет банк,Интернет банк
оплатить счет,Обслуживание карт
я пополнил по интернету и ко мне не исполнив пришел,Кредит
перевод деньги,Денежные переводы
а то,Кредит
