answer,theme
алло здравствуйте вчера был вопрос о работе оператора с вашего банка,Перевод на оператора
перевод с расчетного счета,Расчетный счет
нет меня вопрос по поводу вашего на ваши звонков,Вам звонили
узнать ближайший адрес,Адреса офисов и банкоматов
зачисление на счет,Обслуживание карт
валюта продажа,Курсы валют
хотелось бы проконсультироваться с руководством по поводу закрытие расчетного счета юридического лица,Расчетный счет
кредиту,Кредит
здесь действующей оплата по кредиту,Действующий кредит
мне нужен сотрудник соедините пожалуйста,Перевод на оператора
меня интересует я в том году да тоже погасил кредит,Действующий кредит
я справку заказу банка мне прислали а деньги не только как она пойдет или нет мне интересно,Обслуживание вкладов
офис ну как алло,Адреса офисов и банкоматов
с кем мне надо,Карты
а я подключал акциям о телефона интернет сообщение,Акции
алло добрый день я бы хотела,Приветствие
почему не приходит смс что у меня не погашена задолженность как да я внесла деньги еще до две да,Задолженность
этот хотел баланс узнать,Обслуживание карт
расчетный счет юридических лиц,Расчетный счет
мне надо заблокировать карточку,Блокировка карты
открыть вклада,Открыте вклада
открытие счета одобрили,Расчетный счет
номер счета карты хочу узнать,Реквизиты банка
я хочу узнать сумму оплаты по карте,Обслуживание карт
я бы хотела бы узнать у меня код прислали,Обслуживание карт
на карта,Карты
банкомат на ленина шестнадцать не выдал деньги,Не работает банкомат
вопрос по кредиту действующим,Действующий кредит
общение как к получению кредита,Получения кредита
я не появились,Адреса офисов и банкоматов
обслуживание текущую,Обслуживание вкладов
здравствуйте у меня интересует нет что пришла смска с каким то кодом что сообщить нужно банке,Обслуживание карт
меня интересует там какой то смс пришло что я погасил кредит,Действующий кредит
нет не по карте а по счету банке,Карты
соединить с тюменским отделение,Адреса офисов и банкоматов
ленте вы сейчас позвонили на телефон,Вам звонили
насчет кредита хотел проконсультироваться у специалиста,Получения кредита
работа с юридическими лицами,Интернет банк
угу да,Кредит
получение кредита хочу получить кредит,Получения кредита
потребительский кредит интересует,Кредит
обслуживание кредитных карт,Кредитные карты
отделения в туле,Адреса офисов и банкоматов
физические лица соедините меня с физическими лицами,Физические лица
проблема,Карты
хотим закрыть вклад узнать надо ли заказать заранее деньги,Обслуживание вкладов
нам нужен пароль от мобильного банка,Мобильный банк
задолженности по кредиту,Задолженность
филиал,Адреса офисов и банкоматов
где в по кредиту,Кредит
погашение кредита переплаты,Действующий кредит
мне нужно передать код,Обслуживание карт
да я заявку на получение кредита,Получения кредита
узнать в субботу работает банк,Адреса офисов и банкоматов
какой курс как,Курсы валют
я погасила кредит уже,Действующий кредит
как подключить смс информирование на карте,Карты
город доллара,Курс доллара
какой там процент,Процентные ставки
вы можете соединить с сотрудником,Перевод на оператора
вопрос по заработной карте,Карты
какие документы нужно для оформления кредита,Получения кредита
чуть карты,Карты
консультант конце июня,Перевод на оператора
активации интернет банка,Интернет банк
можно ли у вас оформить кредит,Получения кредита
через какой банкомат можно заплатить,Обслуживание карт
доллара продажи,Курс доллара
меня есть уже кредит я хочу по своему кредита проконсультироваться,Получения кредита
сумма кредита,Кредит
забыл пароль три дэ секьюри как восстановить,Интернет банк
мне приходят смски по поводу кредита вот я хотела бы уточнить,Получения кредита
здравствуйте у меня не за,Приветствие
расчетный счет банка,Реквизиты банка
просто на восстановление пароля интернет банк,Интернет банк
оператора дайте,Перевод на оператора
кредит хочу взять и,Получения кредита
хотела бы узнать пополнение кредита,Получения кредита
э действующей кредит и хотел узнать какая сумма осталась,Получения кредита
вклад закрытие вклада,Вклад
ну у нас перевод не проходит,Карты
при с карты,Карты
перевод с карты на карты,Карты
деньги застряли в банкомате,Не работает банкомат
алло здравствуйте скажите пожалуйста вот мне мы перевели деньги на вторую карточку можно как вот мне снять деньги наличные,Карты
данные по кредиту,Кредит
заполнение заявки на на открытие расчетного счета,Расчетный счет
мне пришла смс с кодом вот я хотел узнать что куда можно подойти как узнать подробности,Обслуживание карт
хочу узнать решение по кредиту,Получения кредита
заблокировать карту на карту край,Блокировка карты
я решила сегодня проверить баланс по карте,Обслуживание карт
что то мне платежа в бюджеты,Обслуживание карт
не звонок от вас был только что,Вам звонили
когда можно приехать в банк для оформления кредита,Получения кредита
или по ямало бы правки платежа,Обслуживание карт
восемь десять,Карты
где филиал вашего банка,Адреса офисов и банкоматов
условия карты виза голд максим,Получение карты
меня интересует оплата кредита в другом банке и какая комиссия,Действующий кредит
мне пришло на телефон,Обслуживание карт
сумма банкомат,Адреса офисов и банкоматов
адрес банка волжском,Адреса офисов и банкоматов
да я вас слышу хочу приобрести доллар,Курс доллара
мне нужно подключить интернет банк,Интернет банк
забыл пароль и,Интернет банк
здесь свыше карт,Карты
по действующей карте у меня действующих карта которую не пополняется пенсии,Обслуживание карт
меня интересует что вы мне звонили,Вам звонили
телефон банка чисто пускай двадцать шесть тридцать пять,Мобильный банк
закончился срок действия карты,Получение карты
снять большую сумму наличных денег,Обслуживание карт
вопрос по действующих карта не проходит платежи,Обслуживание карт
хочу узнать месте,Адреса офисов и банкоматов
алло какой то там этот дай мне оператора,Перевод на оператора
снятие вклада,Вклад
я хотела разобраться по кредиту,Получения кредита
я проверила с карточки да я,Карты
режиме в мае была отправлена заявка теле за,Обслуживание карт
отмена покупки возврат денег на карту,Обслуживание карт
выдает курс доллара,Курс доллара
за что код электронный гос какой то а это видимо это робот,Обслуживание карт
отложенный платеж,Обслуживание карт
не прошел не прошла оплата либо для по нарушает правил народного движение семнадцать,Обслуживание карт
как учета звонили из я пока ничего не интересует,Вам звонили
что б меня соединили с операционистом,Перевод на оператора
блокировка карт,Блокировка карты
интернет банк в алло,Интернет банк
алло вы мне звонили я хотела бы узнать по какому поводу пожалуйста перезвоните,Вам звонили
меня интересует открытие вклада,Открыте вклада
обслуживание действующих вклада,Обслуживание вкладов
меня интересует меня я как у меня кредитная карта есть я это немножко то там ли вы с платежом не,Обслуживание кредитных карт
узнать баланс баланс карты,Обслуживание карт
нужно узнать обмен валют курсы,Курсы валют
этот он не получала это по кода,Обслуживание карт
мне пришла заявка по поводу кредита я бы хотел узнать надо,Получения кредита
тур кредит,Кредит
вопрос я по квитанции как у меня сумма платить,Обслуживание карт
я не знаю что вас интересует мне сейчас звонили,Вам звонили
банкомат не отдает карточку,Не работает банкомат
юридические лица движение,Юридические лица
пост терминала,Пос терминал
ну грубо да вот смска пришла блин с утра вот договора приходили банк,Кредит
оплата москву,Обслуживание карт
мне прислали смску надо сообщить и код,Обслуживание карт
он,Кредит
а здесь с нее доллары это автоответчик,Курс доллара
а мне баланс по кредитной карте пожалуйста,Обслуживание кредитных карт
банкомат не принимает денег,Не работает банкомат
не карт,Карты
повышения лимит о дебетовой карты,Обслуживание карт
мне нужен какой нибудь из менеджера,Перевод на оператора
а мне чек чек выдал ошибку,Получение карты
приобретение валюты,Курсы валют
работает ли банкомат на сдать налично,Адреса офисов и банкоматов
отключить москва звонки,Вам звонили
алло город нижний тагил,Карты
я потеряла карточку девушка ответьте,Обслуживание карт
пая дура деньги,Интернет банк
есть ли предложение по ну вот получить кредит,Получения кредита
подскажите пожалуйста могу купить доллары пятьдесят семь,Курс доллара
нет я заплатил а мне позвонят чтобы заплатить,Обслуживание карт
можно платеж перенести,Действующий кредит
со вклада,Вклад
сколько данный код всего меня,Обслуживание карт
меня интересует вопрос по кредиту точно досрочном погашении кредита,Действующий кредит
оформление платежном поручении,Платежное поручение
в россии и за там какой то счет,Карты
как оформить кредит,Получения кредита
карта получить пенсии,Обслуживание карт
вопрос мне нужно вложить за кредит оплатить у меня ничего не получается в чем дело то,Действующий кредит
взять кредит взять кредит,Получения кредита
вклады узнать какой процент вклада,Открыте вклада
неправильно списали деньги за кредит не полное сумму,Обслуживание карт
нужно поменять доллара,Курс доллара
заплатила,Обслуживание карт
меня интересует одобрили мне кредит,Кредит
узнать про карту,Карты
тот вопрос где этот вопрос,Действующий кредит
а неправильно пин код набрали и карточка заблокировалась что в этом случае делать,Обслуживание карт
алло находится банк,Адреса офисов и банкоматов
у меня остаток по почему так минус тысячи двенадцать по карте бы хотелось узнать в чем причина кто то я не снимала,Обслуживание карт
переводы на банковскую карту,Карты
меня интересует информация по карточке,Карты
консультация по вкладу,Перевод на оператора
здравствуйте я по,Приветствие
восстановить код можно не,Обслуживание карт
реструктуризация,Задолженность
телефон консультация специалиста,Перевод на оператора
все вот почему да,Кредит
условия перевода денег в ваш банк,Денежные переводы
мне нужно узнать поступили ли деньги на карту,Получение карты
алло баланс карты,Обслуживание карт
по действует карт,Обслуживание карт
я банкомат,Адреса офисов и банкоматов
меня интересует пополнение не моей пенсионный карточки пенсии которым еще не,Обслуживание карт
подтверждение трудоустройство сотрудника,Перевод на оператора
он лайн банк интернет банк,Интернет банк
я хочу с оператором связаться,Перевод на оператора
ответ сотрудника банка,Перевод на оператора
заблокировать,Блокировка карты
идите оператором,Перевод на оператора
у меня вопрос по действующих карты,Обслуживание карт
вклада девять открытии вклада девять про,Открыте вклада
тому номеру скажите код,Обслуживание карт
алло здравствуйте можно говорить,Приветствие
мне нужно настроить картами поменять наименование клиента с английского на русский с к,Получение карты
вопрос по действующей карты,Обслуживание карт
меня интересует кредит на выгодных условиях,Получения кредита
да да совершенно верно,Кредит
найти офис,Адреса офисов и банкоматов
меня интересует покупка доллара сколько стоит этот купить доллар,Курс доллара
да да иванович,Кредит
снятие наличных с другого терминал,Обслуживание карт
узнать режим карты,Карты
мне бы поговорить с олегом михайловичем самом как нам не дал филиале ксандр,Адреса офисов и банкоматов
у меня вопрос по действующим,Действующий кредит
одобрен кредит или не одобрен кредит,Кредит
активируйте честно какого,Обслуживание карт
карту это пор не активизирована хочу узнать почему,Обслуживание карт
открыть расчетный счет для о,Расчетный счет
по у меня в кредит взять,Получения кредита
я звоню по поводу просрочки,Задолженность
а скажите пожалуйста мне перестали приходить смс оповещения об операциях по кредитной карте,Кредитные карты
о действующих карт,Обслуживание карт
банка по кредиту,Кредит
мне нужна прислать пароль на интернет банк,Интернет банк
да а вы с очередь не,Кредит
долг мне нужно долг по снять,Задолженность
когда придет платеж по расчетного счета и с,Обслуживание карт
как восстановить пароль к интернет банку,Интернет банк
работает ли банкомат на взнос наличными,Адреса офисов и банкоматов
мне пришла смска мне уже пришел код,Обслуживание карт
консультант мне нужен,Перевод на оператора
выпуск карты,Получение карты
вот я хотел бы от вас кредит,Получения кредита
номер карты,Карты
меня интересует как график работы в общем югорск восемьдесят четыре,Адреса офисов и банкоматов
интернет банка,Интернет банк
курс что кредит,Курсы валют
второго числа то по второго марта ну я хотел бы завтра за оплате могу заплатить или нет,Обслуживание карт
пароль в свой,Интернет банк
надо положить евро на вклад,Вклад
закрыть вклад,Вклад
хочу взять из,Получения кредита
четырнадцатого числа было три звонка хотел узнать и содержание,Вам звонили
оплата по долгу по кредиту,Действующий кредит
договор об организации перевода денежных средств по поручению физических лиц,Денежные переводы
а кредит,Кредит
мне адрес нужно филиала,Адреса офисов и банкоматов
он лайн банке,Интернет банк
нет разблокировать на счет лицевой счет я и звоню принимать,Обслуживание карт
отозвать платеж поз,Обслуживание карт
а мне нужно провести провести платежном поручении,Платежное поручение
подключить в интернет банке карту другого банка,Интернет банк
оформить заявку оформить заявку на кредит,Получения кредита
на это вы мне звонили только что сейчас,Вам звонили
вы мне вчера звонили я хотела спросить что мы хотели,Вам звонили
соедините меня с оператора,Перевод на оператора
где ближайший,Адреса офисов и банкоматов
проблема с интернет банком,Интернет банк
я хотел ой,Получения кредита
какие документы может получить кредит,Получения кредита
заявку оставлял на открытие счета менеджер все не перезваниваю,Расчетный счет
сотрудником банка,Перевод на оператора
мне пришла смска с кодом,Обслуживание карт
отделения,Адреса офисов и банкоматов
хотел узнать остаток на карте хотел узнать,Обслуживание карт
здравствуйте я хочу подключить мобильный банк на свой,Мобильный банк
соединение с техподдержкой,Интернет банк
аэрофлот кредит,Кредит
ваш адрес пожалуйста вы во время придумали кредит я приехал узнать адрес у меня нет,Получения кредита
а я сделал перевод денег у меня,Денежные переводы
ничего из расписать платеж,Обслуживание карт
хочется вас код,Обслуживание карт
работаете ли вы,Карты
я просто имею депозит,Вклад
оператора вместо что меня интересует,Перевод на оператора
