answer,theme
идите меня на с оператором,Перевод на оператора
меня интересует то что я по просроченной задолженности я хотел бы погасить полностью кредит,Задолженность
абонент с которым вы разговаривали поставил вызов,Вам звонили
узнать какие документы нужны для кредита,Получения кредита
адрес банкомата который сегодня работает где можно адрес банкомата,Адреса офисов и банкоматов
алло мне нужен олег консультант,Перевод на оператора
город долларов,Курс доллара
etoken вклада,Интернет банк
хотела бы узнать задолженность,Задолженность
хочу по по хочу получить карту это открыть вклад,Получение карты
я хочу узнать статус заявки по кредиту,Получения кредита
мне нужно соединить с оператором,Перевод на оператора
доп офис парка вы,Адреса офисов и банкоматов
остаток задолженности по кредиту на сегодняшний день,Действующий кредит
подскажите отделение,Адреса офисов и банкоматов
работа банк клиент,Интернет банк
сколько платить уже кредит,Действующий кредит
а по оформила карта в вашем банке,Получение карты
вопросы по текущий карте,Обслуживание карт
у меня есть кредит и здесь,Кредит
нет оператор,Перевод на оператора
платежи со счета,Обслуживание карт
служба техподдержка,Интернет банк
сотрудники,Перевод на оператора
человек,Перевод на оператора
вклад праздничными,Вклад
по оплате за кредит тур,Действующий кредит
вопрос по действующей кредитной карте,Кредитные карты
алло,Кредитные карты
я оставляла заявку на карточку мне надо узнать,Карты
поэтому номер а мне звонили я хотела бы уточнить то вот все хотели,Вам звонили
соедините со специалистом соедините со специалистом,Перевод на оператора
мне пришла смс по кредиту,Кредит
нам нужно перенести отложенный,Интернет банк
а расчетный счет,Расчетный счет
страховка по кредит,Кредит
меня интересует оформление извещать меня по вкладу,Вклад
оплата обучения университета,Обслуживание карт
пришла смска что на к там на какой то карте минус восемьдесят пять тысяч каким узнать,Обслуживание карт
у меня такой кому то по карте,Карты
вопрос по клиент банку индивидуального предпринимателя,Юридические лица
что вы мне звонили,Вам звонили
нет я хочу получить кредит,Получения кредита
заблокирован счет узнать как это исправить,Блокировка карты
где находится банка об у меня интересует,Адреса офисов и банкоматов
справка о кредитной истории,Кредит
идет с карты на карту надо деньги вот на карту не дает чек изъял карту даже туда положить с другой карты,Обслуживание карт
по платежному поручению оплата,Обслуживание карт
с ней кредита,Кредит
кредит кредит наличными,Получения кредита
по действующей карточки меня ко вопрос,Обслуживание карт
вопрос по сумме кредитные карты,Кредитные карты
нет не кредит а кредитная карта,Обслуживание кредитных карт
нет хотел получить карту новую,Получение карты
мне на телефон пришло сообщение то что мне одобрили кредит хотелось бы узнать адрес вашего банка,Адреса офисов и банкоматов
жду соединения с оператором,Перевод на оператора
меня интересует узнать условия кредитования,Получения кредита
что в связи с техподдержкой,Интернет банк
платеж по кредиту по ней еще,Действующий кредит
новый пароль получить,Получение карты
со скольки часов работаете,Адреса офисов и банкоматов
здравствуйте а могу я услышать оператора,Перевод на оператора
здравствуйте интересует телефон технической поддержки,Интернет банк
не могу активировать,Обслуживание карт
прошел платеж или нет,Обслуживание карт
здравствуйте я вот оставляла заявку на кредит и не пойму когда ответ будет я что то уже один сто числа там а где у заявку в субботу,Получения кредита
кредита по кредитной карте,Обслуживание кредитных карт
меня мне звонили,Вам звонили
действующей расчетный счет индивидуального предпринимателя,Юридические лица
льготный кредит для пенсионеров,Кредит
вклады вклады вклады,Вклад
как с кодом что делать,Обслуживание карт
вы на звонили,Вам звонили
я хотел бы уплате узнать почему оплата кредита снялась связи с чем это,Получения кредита
и ставка по вкладам,Вклад
потерял не,Обслуживание карт
не интересует меня на руках карты я бы хотел узнать какая на дебетовой или кредиту,Получения кредита
что делать если на карту заблокировали,Блокировка карты
меня интересует зачисление на мою карту наград,Обслуживание карт
баланс баланс карты,Обслуживание карт
мне нужно поговорить с сотрудником банка,Перевод на оператора
забыл пароль от,Интернет банк
меня интересует платеж по кредиту,Действующий кредит
хотелось бы перенести оплату кредита на более поздние время связи со сложившейся семи номер стоят с вами,Действующий кредит
э создают платежное поручение,Платежное поручение
я хочу карты,Карты
семьдесят шесть ноль четыре,Карты
действующего карта,Обслуживание карт
техподдержка и свяжите пожалуйста,Интернет банк
мне надо знать техподдержка,Интернет банк
когда с не по кредиту,Кредит
здравствуйте здравствуйте здравствуйте,Приветствие
франка,Курсы валют
алло добрый день девушка мне кредита одобрять я просто я не могла по состоянии здоровья подъехать,Приветствие
получение клуб,Получения кредита
да нам уже пришел ответ,Кредит
оплата обучения внести эти,Обслуживание карт
насчет кредита у меня,Кредит
у меня просроченная задолженность хотел бы поговорить это,Задолженность
кредитной карте овердрафта,Кредитные карты
счет по вкладу,Вклад
ну про никакой,Кредит
кода,Обслуживание карт
обслуживание ипотека,Кредит
поддержка утром банка,Интернет банк
меня интересует от э остаток кредита который я плачу вот хотел бы узнать сколько осталось,Получения кредита
фунт стерлингов английский,Курсы валют
консультация по оформление кредита,Получения кредита
меня интересует список документов для оформления кредита,Получения кредита
не знаю можно найти,Адреса офисов и банкоматов
по какому адресу по каком адреса в городе краснодаре можно пообщаться по поводу кредита вот в банке,Адреса офисов и банкоматов
лучше карта,Карты
кредиты физ лица,Кредит
я как,Кредит
забыли пароль и орган,Интернет банк
интернет банк техподдержка,Интернет банк
мне интересно вклады вас под какие проценты нижний новгород и филиалы есть в автозаводском районе,Адреса офисов и банкоматов
я открывала расчетный счет и мне до сих пор или не сделали мне не одобрили ли мне отказали,Расчетный счет
меня интересует адрес банка в городе москва мне пришло код,Адреса офисов и банкоматов
вы звонили с этого номера мне,Вам звонили
график работы банка в праге блок,Адреса офисов и банкоматов
операции по терминалу,Пос терминал
перевод на десять то еще карту течение какого времени производит,Карты
я заплатил запрос после загранпаспорта,Обслуживание карт
мне на карту пришли деньги что за деньги,Получение карты
как бы потому что карта,Карты
почем по вкладу,Вклад
получение копить мили,Получения кредита
оформление кредитной карты,Продажа кредитных карт
тюменский офис,Адреса офисов и банкоматов
адрес офисов казань,Адреса офисов и банкоматов
зайти в интернет банк,Интернет банк
ну вы мне вы вы мне звонили не могу,Вам звонили
по какому адресу распологаются,Адреса офисов и банкоматов
мне быть там а как листа,Карты
так остаток,Действующий кредит
все закрыто не монеты карта,Обслуживание карт
вопрос о нет постоянный звонки от вас идут на мой номер,Вам звонили
обмен обмен вот валюты,Курсы валют
да строй,Карты
я депозит депозитный вклад я хочу сделать и хочу узнать сколько проценты у вас сегодня для частных вкладчиков,Открыте вклада
да наверное не знаю дом счет,Реквизиты банка
асек работы офиса,Адреса офисов и банкоматов
на карте,Карты
открытие при три открытие расчетного счета,Расчетный счет
закрыть карта,Обслуживание карт
вопрос по кредитной карточке,Кредитные карты
вопрос по здесь вопрос по действующей карте,Обслуживание карт
кредит алло,Кредит
банкомат не работает не могу снять не никакой карта не читает,Не работает банкомат
хочу получить кредит в вашем банке,Получения кредита
у меня карточка осталась в банкомате,Не работает банкомат
вопрос по кредиту уфа по,Действующий кредит
мне одобрили кредит в вашем банке и выслали код,Обслуживание карт
о регистрации,Кредит
люди банк нужен,Перевод на оператора
нас интересует наш пароль,Интернет банк
как узнать где получить кредит который о доп,Получения кредита
алло здравствуйте мне бы узнать номер карточного счета,Реквизиты банка
нет расчетно кассовое обслуживание,Расчетно кассовое обслуживание
меня интересует состояние финансов состоянии моих лицевых счетов открытых в вашем банке в две тысячи одиннадцатом году,Расчетный счет
коммунальные платежи,Обслуживание карт
на карте пять,Карты
текущие вклад,Обслуживание вкладов
действующей карте не могу оплатить интернет,Обслуживание карт
сбой в работе банкомата,Адреса офисов и банкоматов
по,Кредит
деньги на телефон,Обслуживание карт
так наверно,Карты
меня с оператором соедините,Перевод на оператора
мне нужен телефон на филиала,Адреса офисов и банкоматов
узнать как погасить задолженность,Задолженность
банкомат номер сто двадцать четыре три ноля шесть когда ленту заря лиц,Адреса офисов и банкоматов
сделать вклад,Открыте вклада
вопрос о погашении кредита,Действующий кредит
меня интересует сорок пять интернет банк,Интернет банк
движение пять то по карте,Карты
нет я знаю это и западного просто меняет потерялась я хотела заблокировать,Блокировка карты
получении получения,Получения кредита
хочу уточнить что списано комиссия пол перепутала с карточного счета на вклад,Реквизиты банка
под,Карты
консультация по вложении денег банкомат,Перевод на оператора
маркетинг,Интернет банк
банкоматы с функцией приема наличных,Адреса офисов и банкоматов
что ж не с банкомата в универмаге в не только не работает у вас,Не работает банкомат
закрыли расчетный счет организации,Расчетный счет
вклад удобный болдина александр,Вклад
алло чек карту,Карты
э я подавал заявку на кредит,Получения кредита
куда то то лишние деньги за кредит,Кредит
поддержка клиент банка,Интернет банк
мне должна быть платежка перечислено дату надо узнать и сумму,Обслуживание карт
открытие нового вклада процент,Открыте вклада
да хочу подключить карту,Карты
отделение банка,Адреса офисов и банкоматов
меня интересует открытие счета в уфе,Расчетный счет
здравствуйте оператором,Перевод на оператора
здравствуйте у меня интересует на мою карточку,Карты
меня интересует у меня ладно было просто месяце на мне кредит или из не,Кредит
меня вопрос по интернет банку,Интернет банк
алло здравствуйте не списались мы для получения для,Приветствие
мне не нужен мне активации не банк,Обслуживание карт
а банкомат по карте консультации,Обслуживание карт
мне не нет у меня кредитная карточка срок действия подходит перед заказать,Продажа кредитных карт
я хотела узнать по поводу кредита,Получения кредита
я интересует работает ли отделение банка в субботу,Адреса офисов и банкоматов
срочно погасить задолженность,Задолженность
да по карте,Карты
не знаю банк не звонил сам,Вам звонили
я хочу поговорить с оператором по поводу,Перевод на оператора
мне процентные ставки,Процентные ставки
а вы мне звонили,Вам звонили
для карту хочу вернуть,Карты
мне надо бы узнать поступали ли деньги на карту,Получение карты
узнать ваши ли кредит,Получения кредита
режим работы филиала,Адреса офисов и банкоматов
соедините пожалуйста с офисом на один мичуринский екатеринбург,Адреса офисов и банкоматов
поддержка меня интересует,Интернет банк
меня интересует оплата по кредиту действующим,Действующий кредит
банкоматы сторонних банков,Адреса офисов и банкоматов
кредитную карту да,Обслуживание кредитных карт
сколько операции и не карточке можно узнать,Обслуживание карт
у меня карта осталась в банкомате,Не работает банкомат
мне вообще не кредита я хотел узнать более взять в вашем от кредит,Получения кредита
обслуживание кредитные карты обслуживание кредитные карты,Кредитные карты
мне нужен оператор хочу поговорить с оператором,Перевод на оператора
уточните по карточке зарплатной,Обслуживание карт
по вкладам у вас о максимально,Вклад
мы хотели узнать перевели ли деньги на карточку нашел,Обслуживание карт
соединиться со специалистом,Перевод на оператора
кредитная карта,Кредитные карты
терминал вопрос по терминалу интересует,Пос терминал
привязка карт,Карты
меня интересует претензии по списанию комиссии,Претензии
соедините с техподдержка,Интернет банк
а зарегистрироваться в интернете банке,Интернет банк
получение при получении,Получения кредита
она уже оформлено карта,Получение карты
ипотеку,Кредит
внесите звонили,Вам звонили
открыть нет открыть счет на счет,Расчетный счет
мы сами мне позвонили я не знаю что вас интересует,Вам звонили
не могу снять наличные с карты,Обслуживание карт
день офиса со счета на счет не перечисляются уже долгое время,Адреса офисов и банкоматов
нового вклада да,Вклад
а сегодня поступил звонок,Вам звонили
заблокировать карту,Блокировка карты
задолженность к,Задолженность
терминалы мне закрывать не ну,Пос терминал
эквайринг алло,Эквайринг
не я открыла мобильный банк я не пойму по номер счета и счета мне нужно в общем,Обслуживание карт
по текущий карте,Обслуживание карт
я хочу привязать свою карточку к мобильному телефону,Карты
я не могу отправить это первое платеж,Обслуживание карт
меня интересует моя заявка по расчетного счета,Расчетный счет
соединить с диспетчером приехал,Перевод на оператора
абонента подключен или находится в не зоны действий сети,Адреса офисов и банкоматов
меня интересует работа нашего терминала,Пос терминал
куда делись мои деньги которые не сработало карточка,Обслуживание карт
мне звонили с вашего банка,Вам звонили
до скольки банк ловит этих алло алло,Адреса офисов и банкоматов
алло необходим на на телефон отдела по работе задолженности,Задолженность
зачем мне отправил деньги на карту,Обслуживание карт
сумма кредита двести тысяч,Кредит
карточка у меня не проходит по банкомату,Адреса офисов и банкоматов
да я по по карте москва что,Карты
эсэмэски на шлюз могу взять кредит,Получения кредита
я хочу взять у вас кредит так мне не,Получения кредита
пароль,Интернет банк
а что означает написано в при в селе э надо красные пин код,Обслуживание карт
я сейчас акции,Акции
как перевести деньги на счет на во счета,Денежные переводы
обслуживание индивидуальный предприниматель,Юридические лица
по действующим по карте мне надо кинуть на карту туда деньги,Обслуживание карт
